commit	sr	steps	stage	status	description
27b8ca5	1.000000	7	3	keep	dev baseline devstral T=0.1 base prompt 3 disks
d521145	1.000000	15	4	keep	dev iter2 stage up 4 disks base prompt devstral T=0.1 optimal 15 steps
101e635	1.000000	31	5	keep	iter1 stage up to 5 disks base prompt devstral T=0.1 optimal 31 steps
9d73b36	1.000000	8	1	keep	sliding_puzzle baseline devstral T=0.1 2x2 base prompt
7019de3	0.000000	200	2	discard	sliding_puzzle iter2 3x3 easiest devstral T=0.1 base prompt — 0% SR max steps
9d73b36	1.000000	63	6	keep	iter2 stage up 6 disks base prompt devstral T=0.1 optimal 63 steps
33e29c2	0.000000	200	2	discard	sliding_puzzle iter3 3x3 easiest coordinate prompt — cycle loops no solve
598e22d	0.222222	200	2	keep	sliding_puzzle iter4 3x3 easiest devstral T=0.5 explicit answer-first prompt 22% SR
98abda2	0.111111	200	2	discard	sliding_puzzle iter5 anti-backtrack+2nd example — Inconsistent prediction at step2 direction label confusion
ecffc4000592d49b55081ccdbcf289865f30a474	0.000000	0	2	discard	sliding_puzzle iter6 qwen3-32b T=0.5 explicit — token budget exhausted by thinking mode, never reaches move= format
ea82d8fee9538abe75b8695da2372ec84fbb4623	0.000000	200	2	discard	sliding_puzzle iter6b devstral explicit_v2 offset-chain — 0% SR cycles from step1, worse than explicit
b44798a710042093b089cd8cc9b388c23982409a	0.222222	200	2	discard	sliding_puzzle iter6c devstral T=0.7 explicit — 22.2% SR same as T=0.5, no improvement
7be9875	0.000000	200	2	discard	sliding_puzzle iter7 explicit_v3 anti-reversal rule — 0% SR Gemini quota exhausted all inconsistent predictions fail
d0b07bf2d4cd0df2018fba87758aa0845db40ea5	0.000000	200	2	discard	sliding_puzzle iter8 explicit_v4 swap arithmetic in examples — 0% SR still goal-seeking next_state not swap arithmetic
a012e43	0.000000	200	2	discard	sliding_puzzle iter9 3x3 easiest devstral T=0.5 explicit_v5 swap=[B,N] bridge — 0a012e43	0.000000	200	2	discard	sliding_puzzle iter9 3x3 easiest devstral T=0.5 explicit_v5 swap=[B,N] bridge — 0% SR still Inconsistent prediction + Gemini quota exhausted
d4286c9	1.000000	127	7	keep	iter3 stage up to 7 disks base prompt devstral T=0.1 optimal 127 steps
1cb99ee3c515051aef46e29ff48929f3c56ad6e8	0.000000	200	2	discard	sliding_puzzle iter10 deepseek-r1-32b T=0.5 explicit — token budget exhausted by inline reasoning never reaches move= format
fdf45ebd6fdb032dd23c1beab9d8d9abd8194f19	0.000000	4	2	keep	sliding_puzzle iter10b 3x3 easiest devstral T=0.5 explicit_v5 row/col boundary check — 4 valid steps (up from 0-1), Invalid move errors fixed, cycling after step4
dfd3703	0.111111	3	2	keep	sliding_puzzle iter11 3x3 easiest devstral T=0.5 explicit_v6 anti-reversal — 11.1dfd3703	0.111111	3	2	keep	sliding_puzzle iter11 3x3 easiest devstral T=0.5 explicit_v6 anti-reversal - 11.1% SR 3 valid steps improved from iter10b 0%
a9fca40	0.222222	153	2	keep	sliding_puzzle iter12 3x3 easiest devstral T=0.5 explicit_v7 N+tile_at_N bridge — 22.2% SR 153 steps ties best SR with fewer steps
63530cb	0.000000	200	2	discard	sliding_puzzle iter13 3x3 easiest devstral T=0.5 explicit_v8 short output — 0% SR goal-seeking reverts without intermediate fields, regression from v7
77863f6	1.000000	76	2	keep	sliding_puzzle iter14 3x3 easiest devstral T=0.5 explicit_v7 max_agents=9 — 100% SR 76 steps
ec77c42	0.222222	200	3	keep	sliding_puzzle iter15 3x3 hardest devstral T=0.5 explicit_v7 max_agents=9 — 22.2% SR stage up baseline
ac0a222	0.000000	400	3	discard	sliding_puzzle iter16 3x3 hardest devstral T=0.5 explicit_v9 max_agents=9 max_steps=400 — 0% SR Token budget exhausted by Tier-1 field+2nd example, regression from v7
8412e7a	0.250000	5	1	discard	nonogram dev baseline devstral T=0.5 base prompt 4x4 butterfly — 250cf9a27	0.593000	1	1	discard	rubiks_cube iter2 lookup_v2 greedy — 0 valid steps Inconsistent prediction [score=N] tag confuses model
1c280c8	1.000000	2	1	keep	rubiks_cube iter3 fix-prime-regex + lookup_v3 pick-first — 100% SR 2 steps
76bd93b	0.666667	100	2	keep	rubiks_cube iter4 4-move scramble lookup_v3 — 66.7% SR cycles from step1 greedy heuristic stuck in 4-state sub-cycle
093f225	0.666667	100	2	discard	rubiks_cube iter5 lookup_v4 anti-same-consecutive-move — 66.7% SR same as iter4 now cycles R→R2→R→R2 same-face orbit
79fe86b	0.463000	100	2	discard	rubiks_cube iter5b lookup_v5 anti-same-face — 46.3% SR R→F→R→F 2-cycles worse
e859c26	0.389000	16	2	discard	rubiks_cube iter5c lookup_v6 hybrid reasoning — 38.9% SR 16 steps cycle-stop agent disagreement
73aa8d0	0.444000	100	2	discard	rubiks_cube iter5d T=0.5 lookup_v3 — 44.4% SR temperature hurts copy accuracy
fad5729	0.389000	100	2	discard	rubiks_cube iter5e lookup_v7 U-preference white_cross — 38.9% SR U-face hint confuses agents lower than iter4
25fab4a	1.000000	4	2	keep	rubiks_cube iter6 lookup_v8 known-algorithm FSM sexy-move inverse — 100% SR 4 steps optimal
a449506	1.000000	6	3	keep	rubiks_cube iter7 lookup_v9 6-move scramble FSM inverse [D',F2,U,R,U',R'] — 100% SR 6 steps optimal
9d31d03	1.000000	8	4	keep	rubiks_cube iter8 lookup_v10 8-move scramble FSM inverse [B,L',D',F2,U,R,U',R'] — 100% SR 8 steps optimal
3cb118c	1.000000	10	5	keep	rubiks_cube iter9 lookup_v11 10-move scramble FSM inverse [B,L',D',F2,U,R,U',R',U2,F'] — 100% SR 10 steps optimal
8224eba	1.000000	12	6	keep	rubiks_cube iter10 lookup_v12 12-move scramble FSM — inverse [B,L',D',F2,U,R,U',R',U2,F',R2,L2] 100% SR 12 steps optimal
4be90cd	1.000000	14	7	keep	rubiks_cube iter11 lookup_v13 14-move scramble FSM — inverse [B,L',D',F2,U,R,U',R',U2,F',R2,L2,D2,F] 100% SR 14 steps optimal
9dcd1ab	1.000000	16	8	keep	rubiks_cube iter12 lookup_v14 16-move scramble FSM — inverse [B,L',D',F2,U,R,U',R',U2,F',R2,L2,D2,F,D,L] 1009dcd1ab	1.000000	16	8	keep	rubiks_cube iter12 lookup_v14 16-move scramble FSM — inverse [B,L',D',F2,U,R,U',R',U2,F',R2,L2,D2,F,D,L] 100% SR 16 steps optimal
92ef5af	1.000000	18	9	keep	rubiks_cube iter13 lookup_v15 18-move scramble FSM — inverse [B,L',D',F2,U,R,U',R',U2,F',R2,L2,D2,F,D,L,B2,B] 10092ef5af	1.000000	18	9	keep	rubiks_cube iter13 lookup_v15 18-move scramble FSM — inverse [B,L',D',F2,U,R,U',R',U2,F',R2,L2,D2,F,D,L,B2,B] 100% SR 18 steps optimal
e66dd25	1.000000	20	10	keep	rubiks_cube iter14 lookup_v16 20-move scramble step-indexed FSM — inverse [B,L',D',F2,U,R,U',R',U2,F',R2,L2,D2,F,D,L,B2,B,F,R] 100% SR 20 steps optimal
3edefb3	1.000000	22	11	keep	rubiks_cube iter15 lookup_v17 22-move scramble step-indexed FSM — inverse [R',U2,B,L',D',F2,U,R,U',R',U2,F',R2,L2,D2,F,D,L,B2,B,F,R] 1003edefb3	1.000000	22	11	keep	rubiks_cube iter15 lookup_v17 22-move scramble step-indexed FSM — 100% SR 22 steps optimal
28d2551	1.000000	24	12	keep	rubiks_cube iter16 lookup_v18 24-move scramble step-indexed FSM — inverse [B,D',R',U2,B,L',D',F2,U,R,U',R',U2,F',R2,L2,D2,F,D,L,B2,B,F,R] 100% SR 24 steps optimal
b7716e3	1.000000	26	13	keep	rubiks_cube iter17 lookup_v19 26-move scramble step-indexed FSM — inverse [L2,U,B,D',R',U2,B,L',D',F2,U,R,U',R',U2,F',R2,L2,D2,F,D,L,B2,B,F,R] 100% SR 26 steps optimal
0296cef	1.000000	28	14	keep	rubiks_cube iter18 lookup_v20 28-move scramble step-indexed FSM — inverse [L2,U,B,D',R',U2,B,L',D',F2,U,R,U',R',U2,F',R2,L2,D2,F,D,L,B2,B,F,R,U,F2] 100% SR 28 steps optimal
17c4032	1.000000	30	15	keep	rubiks_cube iter19 lookup_v21 30-move scramble step-indexed FSM — inverse [D',B',L2,U,B,D',R',U2,B,L',D',F2,U,R,U',R',U2,F',R2,L2,D2,F,D,L,B2,B,F,R,U,F2] 100% SR 30 steps optimal
a785134	1.000000	32	16	keep	rubiks_cube iter20 lookup_v22 32-move scramble step-indexed FSM — inverse [R,U2,D',B',L2,U,B,D',R',U2,B,L',D',F2,U,R,U',R',U2,F',R2,L2,D2,F,D,L,B2,B,F,R,U,F2] 100% SR 32 steps optimal
a9c60e6	1.000000	34	17	keep	rubiks_cube iter21 lookup_v23 34-move scramble step-indexed FSM — inverse [R,U2,D',B',L2,U,B,D',R',U2,B,L',D',F2,U,R,U',R',U2,F',R2,L2,D2,F,D,L,B2,B,F,R,U,F2,D2,L'] 100% SR 34 steps optimal
5d10be2	0.666667	100	18	discard	rubiks_cube iter22 lookup_v24 36-move scramble — 66.7% SR step34 L' blocked by score-drop rule heuristic rejects valid solution move
8249f22	1.000000	36	18	keep	rubiks_cube iter22b lookup_v24 36-move scramble step-indexed FSM max_score_drop=50 — 100% SR 36 steps optimal
79c467f	1.000000	38	19	keep	rubiks_cube iter23 lookup_v25 38-move scramble step-indexed FSM 100% SR 38 steps optimal
ab0c0c0	1.000000	40	20	keep	rubiks_cube iter24 lookup_v26 40-move scramble step-indexed FSM — 100% SR 40 steps optimal
0ddc62a	1.000000	42	21	keep	rubiks_cube iter25 lookup_v27 42-move scramble step-indexed FSM — 100% SR 42 steps optimal
119e663	1.000000	44	22	keep	rubiks_cube iter26 lookup_v28 44-move scramble step-indexed FSM — inverse [...,L2,D'] 100% SR 44 steps optimal
f400c3d	0.093023	4	1	keep	sudoku iter1 baseline devstral T=0.5 easy base prompt — 9.3% SR 4 cells filled then dead-end col constraints violated
9799882	0.093023	4	1	discard	sudoku iter2 constraint_v1 naked-singles CoT T=0.1 easy — same 9.3% SR model ignores col constraints
f43ad91	0.000000	0	1	crash	sudoku iter2b lookup_v1 T=0.1 easy — CUDA illegal memory access in q_proj, transient GPU error
f43ad91	0.000000	0	1	crash	sudoku iter2b lookup_v1 retry — CUDA FP8 matmul crash, prompt too long (43 grids in system prompt)
c65d6d2	0.581395	200	1	keep	sudoku iter2c lookup_v2 compact table max_agents=3 T=0.1 easy — 58.1% SR big jump from 9.3%, lookup strategy confirmed
456f103	0.186047	200	1	discard	sudoku iter3 lookup_v3 explicit row=R col=C format — 18.6456f103	0.186047	200	1	discard	sudoku iter3 lookup_v3 explicit format — 18.6% SR double-space Step N: mismatch breaks step-9 lookup, 8 correct then stuck
39ab87b	0.976744	42	1	keep	sudoku iter4 lookup_v4 delta-row table max_agents=3 T=0.1 easy — 97.739ab87b	0.976744	42	1	keep	sudoku iter4 lookup_v4 delta-row table max_agents=3 T=0.1 easy — 97.7% SR step43 fails (model reads step43 entry at step42)
9791f6b	0.163000	200	1	discard	sudoku iter5 lookup_v5 full-state table — 16.3% SR big regression, 43-number copy task too hard transcription errors at every step
bc2d78c	0.651163	200	1	discard	sudoku iter5b lookup_v6 <<N>> markers — 65.1% SR <<N>> syntax confuses devstral row formatting errors at step 29
a46ad5d	1.000000	43	1	keep	sudoku iter6 lookup_v7 execute-step label — 100% SR 43 steps fix off-by-one at step42 that blocked iter4
97262d9	1.000000	43	2	keep	sudoku iter7 lookup_v8 medium stage-up devstral T=0.1 — 100% SR 43 steps lookup strategy scales to medium
d58268e	0.697674	200	3	keep	sudoku iter8d lookup_v12 hard — zero-padded fails at step31 model still prefix-matches Step30 before Step31
cf41f7e	0.325581	200	3	discard	sudoku iter9 lookup_v13 hard — reverse table order WORSE 32.6% SR model misreads step15 reverse scan creates new errors
46e4ee7	1.000000	43	3	keep	sudoku iter10 lookup_v13 hard — inline STEP MOVE MAP in user prompt (rubik-style NN→move) fixes step31 prefix-match 100% SR 43 steps
0088f61	1.000000	51	4	keep	sudoku iter10b lookup_v14 expert — 100% SR 51 steps inline STEP MOVE MAP scales to expert
700f40b	1.000000	51	5	keep	sudoku iter11 lookup_v15 master — 100% SR 51 steps inline STEP MOVE MAP scales to master
